{
  "schema": "clinicalcraft/room-template@1",
  "id": "clinical-lab",
  "name": {"zh-CN": "临床检验科", "en": "Clinical laboratory"},
  "description": {"zh-CN": "临床检验科：生化、血液、血气、尿液、流式细胞、细胞遗传与分子、微生物、病理显微镜和血库，检验工作站统一下单与发报告。", "en": "The clinical laboratory: chemistry, haematology, blood gas, urinalysis, flow cytometry, cytogenetics and molecular, microbiology, pathology microscopy and the blood bank, with one workstation for orders and reports."},
  "kind": "laboratory",
  "size": {"w": 10, "d": 8},
  "floor": "tile-blue",
  "partitions": [
    {"side": "n"},
    {"side": "w"},
    {"side": "e"},
    {"side": "s", "openings": [{"kind": "door", "width": 2.0, "height": 2.6, "offset": 3.0}]}
  ],
  "sign": {"text": {"zh-CN": "检验科", "en": "Laboratory"}, "side": "n", "color": "#f2c978"},
  "lights": [
    {"x": -2.5, "z": -1},
    {"x": 2.5, "z": -1}
  ],
  "placements": [
    {"id": "chemistry", "type": "chemistry-analyzer", "x": -3.6, "z": -3.35, "label": {"zh-CN": "生化免疫分析仪", "en": "Chemistry analyser"}},
    {"id": "hematology", "type": "hematology-analyzer", "x": -1.9, "z": -3.325, "label": {"zh-CN": "血细胞分析仪", "en": "Haematology analyser"}},
    {"id": "blood-gas", "type": "blood-gas-analyzer", "x": -0.8, "z": -3.55, "label": {"zh-CN": "血气分析仪", "en": "Blood-gas analyser"}},
    {"id": "urinalysis", "type": "urinalysis-analyzer", "x": 0.2, "z": -3.5, "label": {"zh-CN": "尿液分析仪", "en": "Urinalysis analyser"}},
    {"id": "flow", "type": "flow-cytometer", "x": 1.75, "z": -3.425, "label": {"zh-CN": "流式细胞仪", "en": "Flow cytometer"}},
    {"id": "cytogenetics", "type": "cytogenetics-workstation", "x": 3.75, "z": -3.425, "label": {"zh-CN": "细胞遗传与分子工作站", "en": "Cytogenetics & molecular"}},
    {"id": "biosafety", "type": "biosafety-cabinet", "x": -4.425, "z": -1.2, "rot": 90, "label": {"zh-CN": "生物安全柜", "en": "Biosafety cabinet"}},
    {"id": "centrifuge", "type": "centrifuge", "x": -4.45, "z": 0.3, "rot": 90},
    {"id": "microscope", "type": "microscope", "x": -4.525, "z": 1.5, "rot": 90, "label": {"zh-CN": "病理显微镜", "en": "Pathology microscope"}},
    {"id": "bench", "type": "lab-bench", "x": 0.3, "z": -0.6},
    {"id": "blood-bank", "type": "blood-bank-fridge", "x": 4.45, "z": -1.6, "rot": 270, "label": {"zh-CN": "血库冰箱", "en": "Blood bank"}},
    {"id": "fridge", "type": "lab-fridge", "x": 4.45, "z": -0.5, "rot": 270},
    {"id": "workstation", "type": "workstation", "x": -2.6, "z": 3.125, "rot": 180, "label": {"zh-CN": "检验工作站", "en": "Lab workstation"}, "capabilities": ["lab-hematology", "lab-chemistry", "lab-blood-gas", "lab-urinalysis", "lab-microbiology", "lab-serology", "lab-endocrine", "flow-cytometry", "blood-bank", "cytology", "histopathology", "cytogenetics", "molecular"]},
    {"id": "sink", "type": "sink", "x": 4.55, "z": 1.2, "rot": 270},
    {"id": "tube-station", "type": "pneumatic-tube-station", "x": 1, "z": 3.625, "rot": 180, "label": {"zh-CN": "气动物流站", "en": "Pneumatic tube station"}}
  ],
  "staff": [
    {"id": "lab-tech", "role": "lab-tech", "name": {"zh-CN": "检验技师", "en": "Lab technician"}, "x": 0.6, "z": 1.3, "rot": 180, "greeting": {"zh-CN": "标本送来了吗？结果出来我会通知你。", "en": "Sent the samples? I will let you know when the results are out."}}
  ],
  "capabilities": ["lab-hematology", "lab-chemistry", "lab-blood-gas", "lab-urinalysis", "lab-microbiology", "lab-serology", "lab-endocrine", "flow-cytometry", "blood-bank", "cytology", "histopathology", "cytogenetics", "molecular"],
  "tags": ["laboratory", "pathology"]
}
