{
  "schema": "clinicalcraft/room-template@1",
  "id": "rehab-gym",
  "name": {"zh-CN": "康复训练室", "en": "Rehabilitation gym"},
  "description": {"zh-CN": "康复训练室：平行杠、两张治疗床、康复踏车、肋木、训练垫、轮椅和身高体重秤。", "en": "A rehabilitation gym: parallel bars, two treatment plinths, exercise bikes, wall bars, exercise mats, a wheelchair and a scale."},
  "kind": "rehabilitation",
  "size": {"w": 10, "d": 8},
  "floor": "wood",
  "partitions": [
    {"side": "n"},
    {"side": "w"},
    {"side": "e"},
    {"side": "s", "openings": [{"kind": "double-door", "width": 2.4, "height": 3, "offset": -2.5}]}
  ],
  "sign": {"text": {"zh-CN": "康复训练室", "en": "Rehabilitation"}, "side": "n", "color": "#5f9e6e"},
  "lights": [
    {"x": -2.5, "z": -1},
    {"x": 2.5, "z": -1},
    {"x": 0, "z": 2}
  ],
  "placements": [
    {"id": "parallel-bars", "type": "parallel-bars", "x": -2.4, "z": -1.4, "rot": 90, "label": {"zh-CN": "平行杠", "en": "Parallel bars"}},
    {"id": "plinth-1", "type": "treatment-plinth", "x": 1.5, "z": -3.45, "rot": 90, "label": {"zh-CN": "治疗床", "en": "Treatment plinth"}},
    {"id": "plinth-2", "type": "treatment-plinth", "x": 3.75, "z": -3.45, "rot": 90, "label": {"zh-CN": "治疗床", "en": "Treatment plinth"}},
    {"id": "bike-1", "type": "exercise-bike", "x": 4.525, "z": 0.3, "rot": 270, "label": {"zh-CN": "康复踏车", "en": "Exercise bike"}},
    {"id": "bike-2", "type": "exercise-bike", "x": 4.525, "z": 1.6, "rot": 270, "label": {"zh-CN": "康复踏车", "en": "Exercise bike"}},
    {"id": "wall-bars-1", "type": "wall-bars", "x": -4.725, "z": 0.7, "rot": 90},
    {"id": "wall-bars-2", "type": "wall-bars", "x": -4.725, "z": 1.9, "rot": 90},
    {"id": "mat", "type": "exercise-mat", "x": 0.6, "z": 1.4, "rot": 90},
    {"id": "scale", "type": "weighing-scale", "x": -4.525, "z": -3.3, "rot": 90, "label": {"zh-CN": "身高体重秤", "en": "Scale"}},
    {"id": "wheelchair", "type": "wheelchair", "x": -1.4, "z": 2.7},
    {"id": "whiteboard", "type": "whiteboard", "x": -2.5, "z": -3.765}
  ],
  "capabilities": ["scale"],
  "tags": ["rehabilitation"]
}
