{
  "schema": "clinicalcraft/room-template@1",
  "id": "ortho-exam",
  "name": {"zh-CN": "骨科检查室", "en": "Orthopaedic examination room"},
  "description": {"zh-CN": "骨科门诊检查室：治疗床、X 线观片灯、夹板与石膏柜、轮椅和病历终端。", "en": "An orthopaedic clinic room: treatment plinth, X-ray film viewer, splint and cast cabinet, wheelchair and a records terminal."},
  "kind": "consult",
  "size": {"w": 6, "d": 8},
  "floor": "floor",
  "partitions": [
    {"side": "n"},
    {"side": "w"},
    {"side": "e"},
    {"side": "s", "openings": [{"kind": "door", "width": 1.6, "height": 2.6, "offset": -1.6}]}
  ],
  "sign": {"text": {"zh-CN": "骨科检查室", "en": "Orthopaedics"}, "side": "n"},
  "lights": [
    {"x": 0, "z": -0.5}
  ],
  "placements": [
    {"id": "plinth", "type": "treatment-plinth", "x": 2.45, "z": -1.2, "label": {"zh-CN": "检查床", "en": "Examination plinth"}},
    {"id": "lightbox", "type": "xray-lightbox", "x": -0.6, "z": -3.75, "label": {"zh-CN": "观片灯", "en": "Film viewer"}},
    {"id": "desk", "type": "desk", "x": -2.475, "z": -1.6, "rot": 90, "label": {"zh-CN": "医生诊桌", "en": "Doctor's desk"}},
    {"id": "doctor-chair", "type": "office-chair", "x": -1.45, "z": -1.6, "rot": 270},
    {"id": "records", "type": "records-terminal", "x": -2.525, "z": 0.6, "rot": 90, "label": {"zh-CN": "病历终端", "en": "Records terminal"}},
    {"id": "splints", "type": "cabinet", "x": 1.2, "z": 3.575, "rot": 180, "label": {"zh-CN": "夹板与石膏柜", "en": "Splint & cast cabinet"}},
    {"id": "wheelchair", "type": "wheelchair", "x": 0.4, "z": 1.4},
    {"id": "sink", "type": "sink", "x": 2.55, "z": 2.6, "rot": 270}
  ],
  "patientSlots": [
    {"id": "slot", "x": 2.3, "z": -1.2, "rot": 270, "posture": "sitting", "bed": "plinth", "accepts": ["outpatient"]}
  ],
  "capabilities": ["records"],
  "tags": ["outpatient", "orthopaedics"]
}
